Reviews,Ratings,Dates,Website
"No room in the empty dining room without a reservation, apparently. We sat in the bar, and server Michael did a fantastic job of steering us towards hits on the menu. After ordering calamari as a starter, I let the server recommend the Roast Chicken. It is a deboned half chicken served with roast veggies. A fantastic dish, it was incredibly tasty. for desert, Michael suggested sticky toffee pudding. I very nearly ordered a second portion it was so good ! The only downside to our visit was the volume of the music. It was so loud conversation was difficult. We had to yell for the server to hear us. And not having room in the empty dining room? That made no sense at all. It never got busy while we were there, leaving us with the impression that they just wanted to fill the bar tables first.",4.0,2016-08-14,TripAdvisor
"When you initially look at the menu, it seems like Reds has all the standard items on a typical bar and grill. However, on closer inspection, they provide their own twist. We tried the lobster guacamole. It was great. I also had the lobster grilled cheese. While the spices seemed to overshadow the lobster it was very good. Service was friendly and attentive. If I get back to Toronto, I would consider eating here again.",4.0,2016-08-14,TripAdvisor
Good place for a casual business meeting with a bite. Thanks for the recommendation by wait staff of the daily special. Enjoyed it.,4.0,2016-08-11,TripAdvisor
I took my fiance brother and his wife to Reds and we had an amzing time the food was spectacular and the service was sublim. i highly recommend this restraunt to anyone whos looking for a reasonably priced meal and great service.,5.0,2016-08-11,TripAdvisor
"Having tried and failed to try out the dining room a couple of months ago, I changed strategies and aimed for a mid-week lunch.This time there was lots of room but full service didn’t begin until 11:30 a.m., so I had 20 minutes to catch up on the news.Simple proved to be best. The Midtown Turkey Club was ideally toasted and all of the ingredients from meat to veggies were as fresh as the farm. The baked potato side was generously stuffed and the accompanying glass of Citra Pinot Grigio hit the spot on yet another hot day.",4.0,2016-08-04,TripAdvisor
"Nice patio and delicious steak ! The service was very good as well. Good choice of wine list. I will definitely visit the place again just for their steak. Overall, the prices were a little on the expensive end but good food overall !",4.0,2016-07-25,TripAdvisor
"Excellent menu with something for everyone. Great service.Weather permitting, try to get a table on the front patio to watch the street scene.",4.0,2016-07-25,TripAdvisor
Visited here twice recently while in Toronto. First night we had the Summerlicous menu which was a great choice and at a very reasonable price. Second visit went A La Carte which worked out a little more expensive. Service on both visits was excellent. Particularly nice is the Dining Room part of the restaurant - fabulous leather chairs,5.0,2016-07-21,TripAdvisor
"I've eaten at Reds several times and have always been pleased by the service. This is not high end dining, It's a rather typical sandwich, burger, pasta menu, not an innovative one. Although the room is handsome looking, it is not au courant and has a bit of a dated feel.The food, however, is dependably good and the wait staff anxious to please.On my last visit, we were rushed and needed to eat something that could be prepared quickly. On the advise of the server, we ordered the tuna tostados and edamame. They came out within 5 minutes. Both were delicious and the plating was good. We left in a hurry to make an appointment and, in the rush, left behind a set of keys. Staff ran some distance to find us on the sidewalk to return them. That's what I call a great service ethic.",4.0,2016-07-19,TripAdvisor
"Ate here a couple of times and I could do it more, the service is fast, efficient and very friendly, the drinks and food were delivered on time and according to the order, very good place I can come any time and recommend it.",4.0,2016-07-18,TripAdvisor
"After a longhaul flight welcome relief to find this place. Great gin and wine less inclined for the mother's ruin. Perfect cocktails, great service, better food, open late and really very good - will go back",5.0,2016-07-18,TripAdvisor
"Best restaurant that I've been as for 3 days stay in Toronto.Friendly staffs,good food,cozy place. Good for family or business",5.0,2016-07-17,TripAdvisor
"Three course meal for 28 dollars!!!!!! And it was a gem.Once again a fantastic meal in Toronto and this time at a superb price.Presentation was brilliant and the meal itself could not have been better. Surroundings were superb and the service, a young lady called Sharlaine, was so pleasant.Absolute MUST place to visit.",5.0,2016-07-16,TripAdvisor
"Went into Reds Midtown Tavern during the middle of a busy lunch hour and we were treated very special. The staff was very accommodating and the food was very good. Salads, burgers....all were very good.",4.0,2016-07-16,TripAdvisor
Pages of choices of gin for your g & t and three kinds of tonic. Enjoyed the Steam whistle Pilsner recommended by our waiter. Good burger. Nice sidewalk patio and quiet and cool inside.,5.0,2016-07-14,TripAdvisor
"Great choice of meals, and the food was excellent. Servings were not large but adequate. Great drink specials. Great wine list. But for upscale dining, this was the slowest service I have had in ages. We weren't in a rush; but, we had to, and others did as well, go find someone to get served/pay etc. Furthermore, their electronic payment service, based on their wifi, did not have sufficient range to reach the patio so servers had to run to a window, enter info, and then rush client through input and run back to the window - looking like geese in a steeplechase! Really just put a WIFI extender on your Patio!",4.0,2016-07-11,TripAdvisor
"Once we sat down and saw the menu we were a bit taken back by the prices, compared to lots of other places we´ve eaten in Toronto. The staff was friendly, and the caesar salad was awesome, but you get a feeling of being exactly where you are, in the middle of the main road of Toronto.",3.0,2016-07-06,TripAdvisor
"We had the best customer service ever at this restaurant! We went to checkout Reds Midtown as it was close to our hotel. We had a bit of a wait for our food, but did not complain to our server (who was extremely attentive and offered apologies for the wait). The on-duty manager approached us, apologized for the wait, thanked us for our patience and said our meal and wine was on the house. Our food was delicious and the service was great. Apparently there was some mix up in the kitchen that caused the wait time. I would definitely go back AND recommend this restaurant.",5.0,2016-07-06,TripAdvisor
"The Pride Parade was 20 feet east and we had excellent seats. We were afraid we would finish our meal too quickly and asked to move on. We need not have worried. It took 30 minutes to get drinks, another 15 minutes to place an order and perhaps 45 minutes for the main courses to arrive. We were on the Latino. The large inside? Relatively empty. Perhaps the cooks were on strike??? The waiter and waitress? Sorry guys, you deserve better support.",2.0,2016-07-05,TripAdvisor
Hugh shoutout to management and staff at Reds. My daughter and I are visiting Toronto for a few days and dropped in to Reds for some dinner. It was a bit of a wait - some confusion in the kitchen(we did not complain) - they apologized sincerely for the confusion and delay and our meal and wine was on the house. Fantastic customer service. The meal was delicious! We will be back AND will definitely recommend. Customer service like this is not common any more and certainly not the norm. Very much appreciated. Thank you again! So sweet!,5.0,2016-06-26,TripAdvisor
"As long as you dont mind the thumping music, this has a large menu from which relatives/friends can find something of their liking in a get-together.The service is fine and the food satisfactory.",4.0,2016-06-19,TripAdvisor
Had lunch here while in town for work. Arrived about 11:30 am and the place was empty. Ordered a burger and fries for lunch....it was good but not great. Seemed pricey for lunch. Thinking they must have a heavy dinner crowd because the lunch crowd never showed up. The staff was attentive and the place was clean and tidy.,3.0,2016-06-10,TripAdvisor
"My colleagues and I were staying at the Chelsea and randomly picked this restaurant. It was absolutely delicious! We went around 5pm and it pretty quiet. There were some mix-ups in our orders, but the food was absolutely delicious.",4.0,2016-06-06,TripAdvisor
"Always a great place to eat. Just enough food and cooked to perfection. a nice selection of chicken, beef, fish and veggie.",5.0,2016-06-04,TripAdvisor
"Just stopped in this past weekend and had a great meal! Lots to choose from on the menu, inside is really large and neat decor. You can watch a game in the bar area and it has outdoor seating and patio. We ordered apps to share. Everything was delicious and the service was great. Will definitely go back and recommend.",4.0,2016-05-30,TripAdvisor
"Went to Reds to celebrate our friends anniversary - they were not disappointed. Great service at all times from everyone. Good selection of food and drink, at reasonable prices. Ambiance great - would go back there again, and again, which we did. The staff were excellent.",5.0,2016-05-30,TripAdvisor
"As an out of towner it was nice to come to a bar that made you feel welcome and served interesting beers and filling bar food. Bit clinical to be cool place to hang out, but went a couple of nights running.",4.0,2016-05-28,TripAdvisor
"This restaurant offer a very good and well prepared food, but the music is in so high volume, that´s make this place too noise. It is almost impossible to mantain a long conversation.",4.0,2016-05-25,TripAdvisor
"I ordered the Caesar salad but it was basically a bowl of leaves of romaine and dumped a half chicken breast on it for $18-20. The place is spacious and not very noisy so, I think that's what you pay for. My friends thought the pork tenderloin was dry. Don't bother with the non-alcoholic drinks - it's also overpriced. Service was polite and good.",3.0,2016-05-21,TripAdvisor
"The place is gorgeous in the sense of someone wanting to make a statement and piling on the cash. Custom glass and steel cabinets on a large scale with fabulous accent and task lighting. All the design detail in the world will not rescue the place from horrible food. The menu is too rambling for the skill of the kitchen staff and some of the dishes are just plain silly. Silly - - something they call nachos which is really ketchup on a deep fried wonyon with more ketchup and what used to be a chicken. - portobello mushroom - this is actually a poorly prepared steak with a not very fresh version of a mushed lobster and a flat tired shoe leather of a mushroom. Served with unpalatable mashed potatoes. Just plain bad - fish and chips. Fish - frozen and refrozen too many times and then battered in a ""Chardonnay Batter"" - horrible. Unseasoned. If you are going to spend that much money on the leasehold improvements for the restaurant - try and have something edible. Worth noting this is from the same corporate entity that brings you a hundred other not very good restaurants across Canada.",2.0,2016-05-19,TripAdvisor
I had dinner at Reds with a group of people and had to go back the next day for lunch. the Caesar Salad is delicious as was the Mushroom Soup.,5.0,2016-05-04,TripAdvisor
"We broke our golden rule of never going back to a place we consider perfect when on a holiday and wish we hadn't. We ate here on our first night in Toronto and it was fantastic. Everything was perfect. The food, the staff, the ambience etc. On our last night we decided we would go back. Mistake. The ambience seemed very different (it was a Thursday and our first night was a Saturday). The waitress didn't write anything down (and consequently got much of it wrong) and the steak was not cooked as expected. They were very good and deducted parts of the bill but we ended up wishing we had not gone back. I am sure that the first night experience was closer to their normal standard but I review as I find. If I was reviewing the two nights separately they would be excellent and poor - I've gone for average.",3.0,2016-04-04,TripAdvisor
"We decided to stay close to the hotel so we ended up here. This restaurant is owned by the same owners as Scaddabush as can be seen with the similar Eddison bulb lighting.We ordered Edamame(we seem to be hooked on these) a humus and pita app. All were good, although the Edamame could have used slightly more salt.I got a chipotle steak, with russet mash, asparagus. I asked for a well done steak (I know, not recommended) when it came it was more medium rare than well. I asked for the correction and they were very apologetic and even the chef apologized through the waiter. It cam back medium well, which was sufficient for me. It tasted great although I could not taste the chipotle or goat cheese.Overall the food came fast, everyone enjoyed there meal, and the service was great. A quick note, they seem to serve the water at room temperature.",4.0,2016-03-21,TripAdvisor
"this restaurant takes up of whole corner of Yonge and Gerrard W. looking in the window all i could see where high tables and high chairs, and almost didn't go in. but when i did they had a dining area with regular tables and chairs.i had the coconut and shrimp with a cole slaw. good number of shrimp with rice and complimented with a very tasty thai sauce. YUUUUUUUUUUUUUUUM! and very reasonable priced.served by the bar tender (shaved head) who was friendly, checked on my needs during my meal, even though i was seated a far distance from the bar.thanks folks -- WILL be back",5.0,2016-03-15,TripAdvisor
"Perfect for a casual business lunch. Not great gastronomy, nothing unusual. Good wine list by the glass. Would not necessiraly make a detour but if around, that is perfectly fine.",3.0,2016-03-13,TripAdvisor
"Your menu it`s not full of options but they are very taste. The Attendance is very good, I received service from a very helpful lady.",4.0,2016-03-06,TripAdvisor
"I highly recommend to try the burgers. My wife and I had the Brixton and I have to say it was the most delicious burger I have ever had. The bun itself is incredible but in combination with the house ground beef and the portobello mushroom and the Swiss cheese, it's a riot. the only downside is the price but considering the location it is understandable.",5.0,2016-03-04,TripAdvisor
"Been to this place couple of times this month and it has been quite the hit and miss. On my first visit, I tried the Peruvian chicken course during their winterlicious offer and it was just about amazing. Especially since it came on offer as a three course meal. On my second, I went with the fried chicken and it was pretty average, almost burnt! The wait staff were very friendly and nice. Overall a nice dining experience.",4.0,2016-02-26,TripAdvisor
Good food and good service. Decent prices. Really nice atmosphere. Very modern. Has some TVs available to watch some sports.,4.0,2016-02-21,TripAdvisor
"4 of my close friends, my wife and I had dinner at Reds Midtown. We were disappointed.We had to beg for a half hour to have a light that was pointed at our table in blinding fashion. They finally changed its focus when we suggested we were going to leave. Reds has limited fish on the menu (they were out of the Pickerel). The Filet Mignon was drab (how can you screw up steaK?) and one of my friends had to wait an extra 20 minutes for his entre (server forgot to input his order). Not happy with Reds Midtown. D & N Toronto",2.0,2016-02-20,TripAdvisor
"Great location, nice atmosphere. Maybe it was just the night but I spent most of my time wondering if anyone knew I was here.",3.0,2016-02-16,TripAdvisor
Reds Midtown more than exceeded our expectations during Winterlicious. Great food and perfect service. Everything we tasted was full of flavour and nicely plated. All the staff really looked after us. We'll be going back for sure.,5.0,2016-02-09,TripAdvisor
"This restaurant has it all good vibes, good music, charming staff, and a wonderful manager who seemed in control of it all. You could tell you were in for some amazing service when you first walk into the place. The food was top notch, my friend changed her mind at the last minute but the order was changed with no problem and brought fresh food. Grade A service",5.0,2016-02-09,TripAdvisor
"Reds Midtown has everything you need for a business lunch - fast, friendly and efficient service and a menu that does the job. The food is a cut above pub fare (but, then again, prices are also a cut above pub prices). Hamburgers, salads and pasta were all pretty good, but not spectacular. Unlike many tavern-style establishments, there is no beverage pressure from the wait staff - if you simply want a glass of water there are no public shaming glances.",4.0,2016-01-19,TripAdvisor
"So I work in the neighbourhood and used to have dinner at the Red's financial district location. I am always happy/satisfied with the meals there but it's not for a cheap lunch/dinner. On that day I sat at the bar, and got their bacon cheese burger and fries. Previously I have had the oysters, sliders, edamame, calamari and they are all what you expect. The service at the bar was excellent, and felt confident that if I had a complaint it would be handled. I have complained previously and they have been good at dealing with it. I will go back, although if you are looking for a better beer list go a little down Gerard same block to Duke's. (same ownership group I think)",4.0,2016-01-14,TripAdvisor
"If you are G&T fan, you need to pay this little place a visit. A whole menu dedicated to the perfect G&T. Tried several and they were all surprisingly unique and delicious. Some pre-made specialities and some options to customize. The food is also quite good. Service was a bit slow and there were not many people in the restaurant at the time. Recommend if you are looking to experience some new G&T options.",4.0,2016-01-01,TripAdvisor
"I visited this establishment for some drinks and have to say the service was awful .Although it's a really nice decor and vibe the servers we had were miserable , uncaring and not helpful at all !!There was a group of about 8 of us who walked in off the street with some ordering food and others just drinks .... The wait time for each ordered drink was anything from 10-20 minutes !! Food was even longer ... Wait time 45 minutes When the bill finally came we were surprised to see an automatic gratuity added to each individual bill .... When we questioned this we were told this was explained to the person on the phone who made the reservation ... We then explained that we had never made any reservations to which the manager then said the server told us this when we first walked in . This was definitely NOT the case and the whole situation left us feeling very uncomfortable that they were questioning our honesty .I've Never experienced such amateurish and poor customer service and will most definitely not be going back here or recommending this bar",1.0,2015-12-22,TripAdvisor
"Seriously..... Best. Nachos. Ever. Period. Perfect distribution, beautiful complimentary flavors. -#Bang#BangkokNachos",5.0,2015-12-21,TripAdvisor
"So I came here on a Friday night and actually had no wait for a table for two, we came around 830-9. For starter we had a calamari, this was a little disappointing. For the price younger a very very small amount of calamari, it's tasty but small portioned wouldn't recommend. For a main I had a steak and truffle fries. Overall steak was tasty and so were the fries but I was not totally blown away. I would personally pick like an Earls or Keg over this I think, just due to the amount of food you get there for your money. This place was a nice change up though, and had a good atmosphere and our server was great. Might go again.",4.0,2015-12-20,TripAdvisor
"The food was not great but it was good, nice busy atmosphere and a great place to talk. I wished they had organic wine but still enjoyed what they had. One thing I would ask: Please tell your staff not to be racist. If it's your opinion, as we chat of other things, that Toronto is becoming ""too diverse,"" and you don't want immigrants here, maybe don't say it out loud. It shocked me, depressed my friend. But the other waitstaff were great. Truthfully? I wouldn't come back because of that guy.",3.0,2015-12-16,TripAdvisor
"Absolutely awful place! I had been living in Toronto for a few months and had read what I thought were good reviews of this place so when friends were over visiting I thought it would be fun to try out. The hostess was the most friendly one and considering we couldn't even catch eye contact with any other members of staff thats saying something! The hostess asked a server to show us to a certain table and instead of saying anything to us eg 'follow me ladies' he just walked off so we decided to follow him. He brought us to a dirty table that had to be wiped down while we just stood around it even though it was a Monday evening with plenty of other free tables. He made a pretty sad attempt at wiping down the table then walked away without so much as a smile. Having worked in the industry for many years everything about this place was just an awful experience from the customers point of view.We were out for the night and willing to spend a good amount here yet after 10 minutes of being absolutely ignored by every single server we put on our coats and left as the hostess just watched us walk out. I almost expected her to check if everything was ok considering she had just ""welcomed"" us in 10 minutes prior but even that is too much to expect here.",1.0,2015-12-15,TripAdvisor
"Nice place, enjoyed the atmosphere, servers were great. Had a couple of drinks and the lobster guacamole. The app was delicious, a tad pricey at 18.95 but lots of big lobster chunks, freak guacamole and awesome in house made chips. Good stuff. Will come again.",4.0,2015-12-12,TripAdvisor
Visited for dinner as I have been here a few times and liked it every time. We went on an Wednesday evening and it was fairly busy. Service was prompt at first but once we got our drinks and placed our food order we were had reseed to get anyone's attention. After waiting over 30 minutes for our food we finally got someone's attention so we could inquire as to status of our order. Our food was finally delivered and we expressed our concern at having to wait so long. The manager looked into the situation and agreed that it should not have taken so long for our food. The manager compted our meals to make up for the inconvenience. Kudos to him and the restaurant!! I would return again!!,4.0,2015-12-11,TripAdvisor
I went to Reds for a business dinner and it was excellent. It was in a great location right between the office and the hotel we were staying at. We all ordered steaks and I in particular ordered the Lobster sirloin and I can't say enough good things. It was cooked to perfection and the mashed potatoes were really good and the asparagus wasn't overcooked. Their wine selection was great too sadly they ran out of the Cab Sav but they didn't hesitate to allow me to try a sample of another wine which was great. The wash rooms were clean and the ambiance was great. Definitely loved the atmosphere. I will definitely have to eat here again next time I'm in the city.,5.0,2015-11-18,TripAdvisor
Reds is a classy place with a great location (which attracted me) but their steak isn't anywhere near the high end they aspire to and the service is just average. I'd go back for drinks but would make dinner reservations elsewhere.,1.0,2015-11-17,TripAdvisor
"Had dinner at Reds Midtown Tavern. The service was average at best, as there were times we could not find our server. Nice restaurant décor and daily drink specials. Food was very good, but they cut-back on portion sizes, which puts the value of eating their into question. Still 50-50 as to whether I'll go back.",3.0,2015-11-15,TripAdvisor
"We ate here before the theatre on the recommendation of the concierge at the hotel. Easy to find, lots of friendly staff, not too busy on a Friday night great vibe. The food is excellent. There were numerous issues with the service - new waitress - annoying manager - bait-and-switch on the wine with no discussion - incorrect bill. They comped us dessert to make up for it. We'd go back - food was that good.",4.0,2015-11-15,TripAdvisor
Took over an hour to get our food and it was pretty bad for what we paid. Our steaks were done wrong and the linguini was all lumpy. The server spilt beer on the birthday boy and didn't even apologize. The atmosphere is beautiful though.,1.0,2015-11-09,TripAdvisor
