Reviews,Ratings,Dates,Website
"While I would not quality this food as great, I would say it was good and did enjoy it..  The starter I had (the berry salad) was exceptional, the main entree (the chicken) was way over-the-top spicy (and I don't mind some heat) even though I asked about the spice-level and was told not hot, and the dessert was just okay (strawberry/gin).    The  waiter we had was outstanding.  He was attentive enough without hovering.  Would I go again?  Yes, but to eat from their regular menu and then I will decide if this would be someplace I'd go to regularly.",4.0,2015-07-07,OpenTable
the menu is limited and the food is so so.  I expected more for what I paid.,3.0,2015-07-06,OpenTable
"We had booked at another restaurant for our anniversary supper only to find out it was closed on Sundays, so Reds Midtown Tavern to the rescue! We'd been here for brunch before and were looking forward to trying their Summerlicious menu.We weren't disappointed! The food was fabulous! We had wine and beer along with our meal.My only (minor) complaint was that service was a tad spotty with about three different people serving us.  Also, long-ish waits between courses and ordering and receiving drink refills.",4.0,2015-07-05,OpenTable
"I go to Reds pretty regularly, and tonight was particularly great. Cocktails and appetizers and mains were fresh, tasty, really well prepared. Service was great.  An excellent experience.",5.0,2015-06-06,OpenTable
"Great service from every member of staff, friendly and attentive in a busy-ish lunchtime. Recommend!",4.0,2015-06-04,OpenTable
"Excellent service, food is nicely presented. Great central location.",4.0,2015-05-28,OpenTable
This was my first dinner experience at Reds Midtown. Food was great as was the service.,4.0,2015-05-23,OpenTable
"Food was good, ambience was nice service was a little slow",3.0,2015-05-23,OpenTable
glad the waitress talked up the fish special - it was delicious,4.0,2015-05-21,OpenTable
"Always have a great time, but the menu changed so much lately! I miss all the sandwich options.  Friendly staff, good for groups with picky eaters.",4.0,2015-05-14,OpenTable
"Pretty good food and a fun ambiance. Friendly service, although sometimes a tad slow (I think the bar often gets backed up. Here are my two small gripes: (1) Reds is great for $5 Creemore on Tuesdays and Wednesdays. However, on two separate occasions their Creemore keg was not functioning. They offered Stella (blech) at the same discounted price, but nothing of a similar taste. Pretty disappointing. (2) Their hostess team is  inept - after checking in and being seated at the table for 30 minutes, I received a call from them asking where I was for my reservation. I confirmed that I had arrived TWICE, yet I still received a no show email from OpenTable. Overall, still a solid choice in the neighbourhood for a quick bite or drinks after work. But there is definitely room for improvement!",3.0,2015-05-12,OpenTable
"Terrific lunch experience for our party of 5.  Patient, friendly and attentive wait staff.  Food was very good.  Recommend the Ceviche appetizer and the Coconut curry soup.  Will difinitely come back, for dinner next time,",4.0,2015-05-10,OpenTable
"Amazing dining experience! Food was great and large portions. Our server, Michael o, was wonderful! Super friendly and nice.  Very helpful for food choices and provided excellent customer service. We al loved our meals and will definitely be back!",5.0,2015-04-25,OpenTable
Extremely noisy --there is not a quiet spot anywhere in the restaurant on the nights they have a dj (which we did not know when making reservation. )  food is good.,3.0,2015-04-16,OpenTable
There was no wait and the staff was great. The food was good but not meant for a foodie. It's a great place to grab a burger and fries.,4.0,2015-04-13,OpenTable
"Very friendly, service is top notch, food was awesome.",5.0,2015-03-27,OpenTable
"This was my second time eating at Reds.  The first time was a wonderful brunch and I wondered if It would be as pleasing on this occasion.  I was very pleasantly surprised that it was even better!  I ha d a cod based seafood stew special which was very innovative and extremely tasty.  I asked the waiter for a copy of his notes to explain the dish and I will try to recreate the recipe at home but I certainly hope to be able to have it again at Reds,",4.0,2015-03-26,OpenTable
"Good choice for the neighbourhood, but so loud!  We were trying to catch up with friends and the volume made it really tough. We were expecting more of a quiet pub atmosphere",4.0,2015-03-21,OpenTable
"Second visit to this location. Reservation for 3 on a Friday night. The bottom line is it took close to 2 hours to eat. Manager walked around and smiled a lot but never came over to address the lengthy delay in getting the food to the table. Two salad mains showed up and then about a 5 minute delay to get a small steak-salad main to the table. Waiter was nice but had to ask him to comp 2 desserts for the slow service. I'm not sure that he would of offered anything had I not asked. The comp desserts showed up on the receipt as ""SLOW""! I realize things can happen at busy times but if manager had of come over and explained the situation and perhaps offered an apology, it would have made a bad situation better.",2.0,2015-03-20,OpenTable
Great service!,5.0,2015-03-20,OpenTable
"We enjoyed the food and the fact that the portions were not too large and prices were good, we shared sliders and had the sirloins, one Oscar and one with Lobster. We enjoyed both but found the sauce very spicy, a bit overwhelming. The Caesars were great. Our server went out of her way to make me mocktails, and no other bar or restaurant we've beem to here lately has done that! The location and decor were perfect and I love being able to make a reservation online! Overall, I'd love to go back!",4.0,2015-03-17,OpenTable
Great food. Great location. Seating was a bit tight but overall great place.,4.0,2015-03-14,OpenTable
"Met a friend for lunch. Enjoyed the lamb and quinoa salad. Reds has a very good wine list. Definitely recommend Reds for lunch, dinner, and late night drinks.",5.0,2015-03-11,OpenTable
"Went to Reds with a couple of friends.  Great atmosphere, an extensive drinks list and warm, friendly service.  Overall, I had a good dining experience.",4.0,2015-03-10,OpenTable
"My bestie and I came to Reds for the first time.  We were seated promptly and service throughout the night was fantastic.  We had a steak and the roasted chicken, which were both served in good portions, full of flavour.  Our server Catherine was very attentive and sweet.  She brought out our dishes and when realizing that my friend had just left to use the ladies room, she took the dishes back to the kitchen to keep them warm.  Overall, it's a real nice place to check out with good food.",4.0,2015-03-07,OpenTable
Customer just need to be careful with their purse since mine got stolen from me during my last visit. But the manager and staff there are really helpful about it.,4.0,2015-03-02,OpenTable
service was ok.  food was passable.   noisy beyond belief...can't hear yourself think or carry conversation with others unless you yell!,3.0,2015-02-26,OpenTable
"This is my second time at this venue and both times there were problems. I booked my reservation through open table and specified under special instructions that I wanted a  birthday dessert for Daniel Felsky.  I also reminded the waiter toward the end of the meal.  A different waiter came and took the dessert order and Daniel did not get anything special with his dessert not even a candle.our original waiter came back after the dessert was finished and apologized and said that a Happy Birthday dessert presentation went to the wrong table and we got the plain dessert. This item was deducted from our bill but we would have preferred that something with Happy Birthday was  brought to the table for Daniel to eat or take home.One of the other party ordered coffee and never received it.My husband orders some sort of steak salad but was disappointed with his meal.  He said it was simply a steak on a bed of leaf lettuce with no other vegetable mixed in or any interesting textures.  My meal was tasty -curry chicken special - but I was disappointed with the quantity which seemed to contain about 4 bite size pieces of chicken and a few snow peas.  I did not feel satiated after the meal.After 2 failed attempts at this venue, I'm not sure that I would eat here again.  I would maybe stop in for a drink.",2.0,2015-02-19,OpenTable
"The decor and ambiance of Reds is nice. A great spot to meet up after work. I've been to Reds before and I was very impressed with the price of their steaks. Unfortunately at this trip to Reds, I was left a little disappointed by the steak dinner that I had. The meat didn't melt in your mouth like in the past. As well, the service was only average. I expected a little more attention, seeing how it was a Wednesday night and the place was not busy at all.",3.0,2015-02-19,OpenTable
"Excellent quality, and quantity for a very reasonable price. Steak and potatoes in downtown Toronto for under $20! Potato flatbread and crab and corn chowder to warm up by on a frigid February evening! Hostesses and servers were friendly...absolutely lovey. Coat check a nice touch and the retro matchstick boxes were a cute giveaway (though not sure what non-smokers would do with them).  On a busy Valentine's day evening, we were not rushed and allowed to take our time between cocktails, appetizers, and main meal at our leisure. Our server was attentive but never intrusive.",4.0,2015-02-14,OpenTable
"The food was very good.  The portion size was great, I left feeling full.  We ordered off of the Winterlicious menu.  I was very impressed with the healthy options.  Reds is a great spot for lunch, but I felt like the main focus would maybe be a spot to stop in after work for drinks and appetizers or hosting a work function.  I would definitely go again.",4.0,2015-02-12,OpenTable
"We really enjoyed the warm, friendly atmosphere.  Service was prompt - important for theatre patrons.  The pork special and bread pudding were excellent.  I'd definitely recommend this to friends.",5.0,2015-02-10,OpenTable
"We tried this place on a whim during Winterlicious, and I'm SO glad!The food was outstanding, big portions too, despite it being a discounted menu. The service was quick and friendly. Though the place was busy and the noise level quite high, I didn't feel like it was overwhelming.I especially love the free coat check!This is a great place to go before or after seeing a movie at either of the nearby theatres.",5.0,2015-02-10,OpenTable
"We had a birthday celebration and ordered from the Winterlicious menu.  It was great!  We had a lovely bottle of Nebbiolo wine for 3 people.  It was excellent and not over the top expensive.  Our server was delightful and sweet and the assistant manager, Dennis, was very personable and extremely welcoming.  It made the evening even more special for us.  Overall it was a thoroughly enjoyable dining experience.  Thank you.",4.0,2015-02-09,OpenTable
Great place! Great menu and service.  Food was fantastic.  Will dine here again.,5.0,2015-02-08,OpenTable
"We had the winterlicious menu which was delicious - sweet potatoes and bacon soup was okay (a tad bland and smaller than I was hoping), beet salad was delicious, chicken madras and pork and beans were both delish, and all the deserts were great! The place was nicely styled but my only qualm was the noise. It is so unnecessary to have music playing so loud at a restaurant that you have to lean in and yell across the table to have a conversation.",4.0,2015-02-07,OpenTable
"The team at Reds were very accommodating to a large group. The food was amazing…the best Winterlicious menu I have tried! The service was also great, the Manager of customer relations took note of what wine we were drinking and gave us a free bottle to share before we left. I would definitely go back and recommend to friends.",4.0,2015-02-06,OpenTable
"Reds uptown is an offshoot of the long standing and reliable Reds in First Canadian Place.Lovely decor, decent food, and sometimes erratic service.",4.0,2015-02-05,OpenTable
"Love the design of the space. The service was excellent and attentive without being bothersome. Lunch was very good, high quality ingredients carefully prepared. Will definitely return. Thank you.",4.0,2015-02-03,OpenTable
"Pleasant staff, great main courses, good drink selection",4.0,2015-02-02,OpenTable
"Was able to get a late reservation for dinner on a Saturday night with a girlfriend.the restaurant was half full at 7:00. Got seated immediately and then waited and waited. servers walking by us - we flagged down a support staff to say please send someone over. I believe the manager came over with menus immediately. Our server came took our drink order and then food order and then never saw him again till we decided to get the bill. Wanted to have another glass of wine and dessert but was so put off by the service. Food was good and ambience was good.  Not sure if this is the norm, such a shame.",3.0,2015-02-01,OpenTable
"We were gifted a SIRCORP gift card and thought we'd try Red's out instead of our usual SIRCORP favourite (Canyon Creek). Once we were seated I noticed they had what is probably the best gin & tonic selection in the city if not Canada. They brought me a perfectly made (and huge) gin and tonic complete with bitters. The night started out perfectly!We ordered the charcuterie board to share, which was dropped off at our table without the customary description of each meat on the board, and without plates or utensils. So we had to sit there staring at the food until we could finally get a waitress to notice us and bring us some plates and cutlery. Unfortunately the charcuterie left much to be desired and could easily have been pre-packaged Piller's products picked up from the supermarket. The bread that came with it was positively stale. It was not crispy, it was stale.For the main my wife ordered the Bacon-Wrapped Filet Mignon and I ordered the Mediterranean Braised Lamb Shank but I replaced the boring polenta side with truffle fries. This was quite simply the BEST entrée I've ever had and completely compensated for the poor service and terrible appetizer. I touched the lamb with my fork and it quite literally fell off the bone into a neat pile on the plate. I always thought that ""fall off the bone"" meat was a myth, but I have to say this was spectacular, tender and perfectly seasoned! The truffle fries were similar perfection and I was a very happy camper. My wife was also very satisfied with the filet mignon.Décor is on trend with the current craze of rustic wood high-top tables and stools, glass-bottle chandeliers, etc.Will come back and skip the appetizer.",4.0,2015-01-31,OpenTable
"The stand outs; service excellence, professional, knowledgeable, genuine, and Ayla the GM, has crafted the combination of that service journey with a chef whose dishes were presented and paired beautifully with wines.Introduced my colleagues to Reds this evening and could not have been more impressed and satisfied. The area is certainly lucky to have this establishment. Well done team!",5.0,2015-01-30,OpenTable
"The food was mediocre, we were there for winterlicious and they rushed each course to our table.",3.0,2015-01-30,OpenTable
"my two friends and I try and take in the ""licous"" events. This year we came across Reds Tavern at Yonge and Gerrard.  The menu was amazing; all of us enjoyed our meals.  Definitely highly recommended!",5.0,2015-01-30,OpenTable
"This is the second location of the popular Red's Tavern.  Apparently it's been open for 6-8 months and that might explain the quieter than normal (compared to the Downtown spot) lunch trade.  The service was great, our server was very friendly and helpful with her menu recommendations.  The food was really good, very well put together and a very generous serving size (I had the tuna salad).They have a great craft gin drinks menu, a bit different and something unique - again a very decent serving size.Overall, a very good lunch, service and food/drinks.  It'll be a matter of time before this place is bouncing every lunch time.",4.0,2015-01-29,OpenTable
I wish I remembered her name but our server was amazing - very sweet. The food was nice and it was an overall nice night. Hope to come back during winterlicious.,5.0,2015-01-27,OpenTable
"Service was better than their food. Unfortunately we go to restaurants for the quality of the food and not the service as the priority. Music was too loud, as such conversation felt like a yelling match between other patrons and ourselves.",3.0,2015-01-23,OpenTable
"The service was very friendly and respectful.  Although I was only meeting up with a friend, it would be a nice comfortable place to have a tasteful business lunch.  Our food was served fairly quickly so that by the end we could make it back to work on time.  I had the Aegean lamb salad.  The meat was very tender and delicious!  I only wished there had been more greens, otherwise, I was very satisfied.",4.0,2015-01-23,OpenTable
"I am a wine-lover... I go to Reds for the wine. I had been to the one on Adelaide a few times before and decided to try Reds Midtown Tavern the other night due to convenience of location. The food was really good, and the staff were awesome! I wasn't familiar with any of the wines on the menu so I asked for some recommendations and our server brought over the bartender. She was amazing... She recommended an amazing wine... We ended up getting a 2nd bottle! (There were 3 of us and we were there for 4 hours ok!?) lolTruly awesome customer service... I will definitely be back!",5.0,2015-01-13,OpenTable
Definitely a good spot to go on a date ! Our server Ian was really cool and attentive and I would definitely go back !!,5.0,2015-01-10,OpenTable
"Second day of 2015,my Partner and I were thinking of having to try their sea food chowder. It was very delicious. While we were having our dinner, our server MARCELA made sure that we are enjoying our meal!  Marcela has a great personality and amazing customer service! An evening that I will never forget!!",3.0,2015-01-03,OpenTable
Not sure why I didn't get my points for booking this through Open Table and dining as reserved.,5.0,2014-12-23,OpenTable
"Our server really helped make the group's experience a great dinner. There is something on the menu for everyone, and the lobster guacamole is a fan favorite. Can't wait to have Reds as an option for brunch again in the New Year!",5.0,2014-12-22,OpenTable
It was a busy Saturday night on main floor. Server was very friendly and polite but she was so busy she could not attend everyone in timely manner.  Way to big of a section.  Waiting over 20 minutes for wine. After food finally arived Noone came to check on it. Steak overcooked. We were expecting much better expiring.,2.0,2014-12-21,OpenTable
Service slow food overpriced!!,2.0,2014-12-18,OpenTable
"Overall the experience was good, I might have even rated it very good if I wasn't comparing it to their Adelaide location which I have frequented over the years and have nothing negative to say about it.  The midtown location is missing the high level of service, the speed and attention to detail that I'm used to.  We were 4 girl friends out for a post-work/pre-Christmas gathering.  The decor and atmosphere of the place was great, but as soon as we sat down we noticed that the lighting was poorly planned over some of the dining tables (half the table was in the dark while the other half was blinded by spotlights), we asked to be seated at a different table (several looked available) on two separate occasions but were told that we'd have the same problem at those tables too and then told that they would dim the lights (which they did not do).  We ended up physically moving our table to a more suitable angle.  When we were seated, we were brought the dinner menus but no drink/wine list - which, for a wine bar is quite the mistake.  We had to ask for the wine list and only got it after we ordered our food.  We decided to not order individual meals, but a bunch of their super tasty appetizers to share.  This might be why we were not asked if we wanted to see a dessert menu, but I think it was inappropriate for them to assume we weren't interested.  We ended up at a coffee shop down the road after for coffee and dessert.The food was fantastic, the wine selection as can be expected was great, and everyone was super nice (just not on the ball).  I believe this location is relatively new so maybe that's why they haven't mastered the art of customer service, but everything else is great and this should not deter anyone from going.  Just expect to ask for what you want without it being offered.",3.0,2014-12-15,OpenTable
"Great service, great people, food was really good.Great service, great people, food was really good.Great service, great people, food was really good.",5.0,2014-12-05,OpenTable
staff may have seemed overly attentive. felt rushed because dishes were removed while we were barely finished.,3.0,2014-11-28,OpenTable
I've been there twice in the past month and have enjoyed myself thoroughly both times. The atmosphere has been incredible and the good has been amazing.,4.0,2014-11-15,OpenTable
"Nice ambiance, although the dining section was quite small.  More bar-style seating with high tables. We sat in the dining area (requested after being seated in the bar) and sat under a bright halogen light. Felt like I was being interrogated all evening. Food was good and service was helpful and prompt.",4.0,2014-11-08,OpenTable
"Food was great.  Waiter was attentive, knowledgeable and helpful.  Really enjoyed the wine.",5.0,2014-11-02,OpenTable
"I have been to Reds Midtown a number of times now. It has great ambience, the staff and welcoming and the food is dependable, allows good.  I prefer sitting downstairs inthe bar area, lot of energy usually but not too noisy.",4.0,2014-11-01,OpenTable
We came here for dinner for the first time - I'd seen a deal thru work perks and wanted to try. The food was awful. Oversalted and dry. A mistake with the order took 10 mins to fix. Had to deal with an arrogant manager who refused a valid coupon. We left as soon as we could and won't be back.Nice inside. The server was kind.,2.0,2014-10-31,OpenTable
"Interesting and tasty cocktails...overall, good experience.",3.0,2014-10-26,OpenTable
"Comparing with many new restos these days, Reds is very spacious with tables of different sizes.  The wine list and menu are extensive. THe cocktails we ordered were pretty good. We like the choices of the shareables.  The LOBSTER GUACAMOLE was nicely presented, but it was a bit under-seasoned. The tortillas were crisp and yummy though. We both ordered the butter chicken as the main. It was very delicious. It was better than some of the well-known Indian restos in down.  There are not too many interesting restos near Dundas Square. Reds is a nice addition to the neighborhood.",4.0,2014-10-20,OpenTable
Great location and atmosphere.  Would definitely dine there with a group again.,4.0,2014-10-17,OpenTable
Pleasant efficient service.  I had brunch and the decadent French toast was the best that I have had - very innovative pairing of ingredients.,4.0,2014-10-04,OpenTable
Fall mains were OK.  Appies and starters were great! Music too loud to compete with so if you are looking for a quiet conversational sort of dining experience you won't find it here (at least not weekend evening).  Service was very good.  Decor was modern and inviting.  Overall a favourable experience.,4.0,2014-09-20,OpenTable
"We brought our 3-month old. We warned the restaurant we were doing this and they found us a corner where we could park the stroller. This is a grown-up place, but they were quite accomodating. If your kid melts-down, you'll have to go, but if they're behaved or sleep through dinner, Reds makes it possible.",4.0,2014-09-13,OpenTable
We have been in Toronto for over a  year traveling for work.  For the past few months we have made Red's our local hangout.  The lobster guacamole is a great app.  I will have to say Phil the bartender makes our return easier as he always takes care of us!,5.0,2014-09-10,OpenTable
The ciopino was awful there were 5 mussels and one scallop and the rest was onions - this is not what is promised by your menu it was such a rip off. The appetizers were mediocre and the nachos were so greasy that we both had a stomach ache.I great disappointment from the last time I was at Reds. I am not likely to go again.,3.0,2014-09-05,OpenTable
"everything was above avg or very good except for the food availability. No steak, chicken or any shellfish (or dishes that contained shellfish) was available on a special occasion staff lunch we planned for that day. Very disappointed about that aspect as quite a few of the menu options consists of these items. Must say that this alone has deterred me from going back for food but would consider going for drinks.",4.0,2014-09-02,OpenTable
"Impressed with venue, unique lighting but food was good quality and server knowledgeable and pleasant, an enjoyable visit for dinner with two associates.",4.0,2014-08-24,OpenTable
