Reviews,Ratings,Dates,Website
"The first time I started dining here was due to summerlicious. My friends and I all loved their summerlicious menu. Everything they serve was absolutely delicious. The flavours were just right and the steaks were perfectly cooked. The fried chicken was crispy on the outside yet juicy on the inside. The pan seared trout was nicely seasoned and not overcooked. As for dessert it was alright. Service was excellent. Visited this place a few times after that and even held my birthday party here. Food was alright but not as good as my summerlicious experience. We had a semi private table closer to the back of the restaurant. Service was still good. My friends brought a cake to cut there and there was a cake cutting fee. Forgot how much though. During my other visits, some of the things that stood out the most is the butter chicken. The butter chicken (16.95) is one of the best I've tried. It tasted rich and flavourful. I seemed very authentic. It was so good that my brown friend even thought it was really authentic for a restaurant that doesn't specialize in this type of cuisine. Portion size of it was pretty small though. The chicken carbonara ($19.99) was not that good. It wasn't as flavourful as expected. Seemed like something was missing. Lobster sirloin - I think it was a 7oz sirloin with lobster bits, mash potatoes and veggies. Not worth it. Felt like it was overprice. It was topped with really little lobster bits for an extra i think $8. You're better off going with a regular sirloin for cheaper. Peppercorn steak ($34.95) - 11oz New York steak. This one was okay but nothing special. A little overcooked. The sauce was good though.The decor is pretty simple and the lighting is pretty dim. It's pretty good for a romantic date. Washrooms are located upstairs. The washrooms nice and clean. Overall, okay place. Something's are reasonably priced but others are a little overpriced for the portion they give.",4.0,2017-03-19,Yelp
"Attended a winterlicious lunch. $18 for 3 courses. I ordered, and enjoyed:Tuna TostadasSteak Bibimbap. (steak slices are pretty obvious. the bibimbap component was ok. Could have used more sauce. This handily beat my expectations of mediocrity)Toffee Cake w Vanilla ice cream(Shrimp Ravioli was good too. It comes with a piece of shrimp on top of each of the 4-5 pieces of ravioli)Simple and good. The prices were quite reasonable.I probably wouldn't rush back outside of winterlicious, because I prefer ethnic restaurants.However, I would return for happy hour, considering it was pretty great during the yelp event which was hosted here a couple of years ago",3.0,2017-01-31,Yelp
"I've been meaning to come to Reds for sometime. Well reviewed and recommended in circles around the office. Often used by colleagues for lunch time office celebrations...birthdays, seasonal celebrations etc. I was a bit nervous because I'm more of a slow, intimate, quite kind of a diner. Less of a steakhouse, loud music kind of a guy. Some of that might be because I'm a vegetarian. The setting was intimate, gentle lighting. Music a touch loud for my delicate constitution but hey, 80's music is always a winner. The food was above, way above expected. Garden salad, truffle fries to start and there was the flash back to Tuscany. My partner had the salmon dish, fingerling potatoes with heirloom carrots and snow peas. 11 out of 10. I had the vegetarian, vegetable fricasee. Delicious, perfectly cooked and bursting in flavour if not a little too busy with the aforementioned flavours. 9.5/10Apple pie with cheddar, outstanding. Espresso delicious. Staff professional, friendly and attentive. What else can be said? Shout out to Felix the waitstaff for making the visit memorable.",4.0,2017-01-24,Yelp
"As a young barrister  I often visited Red's older, fancier sibling further downtown. Now a seasoned public servant I prefer things a bit more casual, a bit less expensive, and a lot less pretentious. While Yonge and Gerrard is hardly ""midtown"" in my book, this Reds outpost has managed to downscale somewhat while keeping food quality high and prices at the upper end of affordable. The room itself is huge; taking up a quadrant of the Aura condo behemoth. Decor is standard vague industrial; poured concrete and reclaimed wood and exposed metal. Nothing we haven't seen before, but done to reasonable effect here. There are a few odd design flourishes: a (non-working) retro cigarette vending machine at the front, and back-lit curios throughout filled with tchatchkes like sunglasses and lighters and keychains. I'm deducting half a star for inconveniently-located washrooms. Unless you nab the accessible unisex guy on the main floor (in plain view of everyone-HEY MA!!! LOOK!!! I'M GONNA PEE!!!) you're running up a few flights of stairs and through a busy alcove. I'll take another quarter-star for the mix of seating. Dining with a small party, we get comfy chairs on tables. As part of an office party, we are directed to a horseshoe of high stools around an elbow-level counter. Let me be clear: I hate the whole high-stool thing. I hate not being able to comfortably slide my chair into dining position under the table. I dislike feeling like I'm teetering during my meal, and while I'm hardly short, I resent feeling like I need a boost to sit in my high chair. This particular seating arrangement also puts one far enough away from the diner directly across from you that you can't make out a goddamn word. The last half-star I deduct is for wait times. Reds proudly proclaims it's a scratch kitchen, which is admirable. At lunch hour, it's a liability. I've never been during a work emergency, but if I did I'd be back on my horse to the office before I even received my menu. I imagine Reds is designed with local office workers in mind...so a few quicker options would be helpful.It's hard to find fault with the food itself. A luncheon steak frites arrives hot and done to a perfect char outside with a bleeding medium.rare heart. The potatoes are a cooked  few shades beyond amber, and shatteringly crisp. I could do without the gratuitous bitter raw greens, which I suspect are meant as garnish...I just usually eat everything on my plate (see: mint leaves at dessert). A return visit yields tender butter chicken, a bit spicier than expected (I usually expect the Indian equivalent of Big Mac Sauce) sided with rice and naan. I'd gladly trade one of the starches for a second veggie curry-saag paneer or chana masala or even roald daal. As it is, the only veg in the house is a fair bit of coarsley chopped onion. There are also appetizers; fries and dips, and beet hummus (which tastes better than it sounds, but is unremarkable). A warm, custom-baked apple pie with ice cream is the highlight. Coffee is strong and refilled frequently. Sometimes, a little bit downscale is just right.",4.0,2017-01-10,Yelp
"I came here for dinner and had wine and entrees. I wish they have nicer sitting areas that are more comfortable. However, the wine, fish and steak were all nice. The salmon was one of the best I've had. It had a really nice crispy crust that is similar to pork rinds. My only complaint is that one of the servers kept walking by giving me dirty looks. Doesn't she get treated out? Sucks to be her. My server was also the bartender. He was professional and prompt 88% of the time.",3.0,2016-12-27,Yelp
"I had to try out Reds for Summerlicious! It was a 3 course lunch for $18. This was a very large restaurant with abundant seating, no reservation needed at the time. We were delightfully seated outside on the courtyard patio.For appetizers, we had the tuna tostadas and crunchy Asian slaw. Both were very good. Great portion on the salad!I ordered the Curry and it came with some fresh veggies, naan, and rice. This dish was ok, not flavourful enough. It was unpleasant to find some pieces of crunchy rice. I wouldn't order it again. The dessert was a strawberry cheesecake in a mason jar. This was excellent, I enjoyed the simplicity of the dish: a layer of strawberry topping, cheesecake-like filling and graham cracker crust at the bottom. It tasted delicious.The servers constantly refilled our glasses of water and they were friendly. We waited a bit longer than usual for our food to arrive.By the end of the meal, we were stuffed. It was nice to try, dessert was definitely my favourite part.",3.0,2016-07-12,Yelp
Their gin and tonic nights are amazing and come in the proper big fish-bowl like glasses served with garnishing appropriate for the type of gin you order. The patio sits right amongst a relatively high traffic area which can be distracting but great if you want to be seen.,4.0,2016-07-29,Yelp
"Second time here. First time they informed me late that the one i ordered is out of stock so they had me ordered again and gave it for me. But all my friends are done and just about to eat. Now, i ordered a medium well steak and my friend ordered a medium rare steak. They interchanged it, so i have mine be cooked again, when they gave it to me. It was burned (see pic)",1.0,2017-03-10,Yelp
"Portions small, overpriced, service was slow even though it was a Wednesday and restaurant was not very busy. Thanks but will not be coming back!",1.0,2016-11-10,Yelp
"Reds is a stable of college park area, catering to many events and dinner parties. Having been there multiple times and sampling most of the menu, here is what I think of it after all these visits.The good: The interior! Reds interior is both beautiful and inviting. It's trendy look is definitely on par with high end dining spaces such as Joey's and Cactus club. It features both a nicely lit interior and also a patio area right outside on Yonge street. The gin & tonic selection is also something to rave about, offering creative options that are both delicious and out of the ordinary. Appetizers are also great sharables with great flavour, offering bold flavour that is a great start to a meal. My favourites are the sticky ribs and the lettuce cups.The bad: Quite recently, the best appetizers on the menu are nowhere to be found. Instead, the newly offered appetizers is just a small set (and quite frankly typical) of appetizers that is offered at any restaurant. Furthermore, Reds used to be a prime location for quality steaks at a good price point. Unfortunately, they've increased the price slightly, putting it in the range of every other wine bars. For what it's worth, the steaks are cooked well.The ugly: On my last visit, either our order was backlogged, or it was simply forgotten. It took an extremely long time to receive the main course. While the waitress was attentive to our order, there should be no reason that it takes over 40 minute plus for our order, despite semi filled restaurant.Here's the thing about reds...it is respectable chain restaurant that serve fantastic appetizers and drinks while focuses on offering a great experience. But it simply does not exceed beyond all the other restaurants of this calibre. While they were something special at one point, they've simply conformed to the status quo.",3.0,2016-06-17,Yelp
"Went last night with a table of 14 for a birthday party. Service was decent and we enjoyed the atmosphere. We also sat at their U shaped table which was pretty cool, we could walk to the middle and talk to each other without being in the way of other customers or servers. The food on the other hand, not so great. I ordered the three course meal for $32 and picked the mushroom soup w/truffle oil, 7 Oz sirloin with the apple pie for dessert. Those of us that got the soup all agreed that it was bland. I was trying to play it safe by asking for my steak to be cooked rare but my steak came out medium. The apple pie crust was delicious but I found the apples in the pie a bit sour for my liking. My girlfriend had the Caesar salad, salmon for main and brownie for dessert. The salmon  was surprisingly moist and the skin was nice and crispy, definitely a good choice. Although she loves chocolate... she couldn't finish her brownie cuz it was too sweet. I wouldn't recommend eating there but nice place to just grab drinks and hang out with friends.",3.0,2017-03-19,Yelp
"Just arrived in to Toronto this evening for one night. Not sure what to eat so I took a walk since i was sitting down for the last 8 hours. Using my Yelp app I came across Reds. Lots of choices in the area. Can only say I made the right choice. Great decor, lighting, music in the background and great staff. See below. As a self proclaimed Margarita snob it's not often I have a Margarita worth recommending. Kudos to Adaina for a great drink. I went for a light meal, the Lobstah Guacamole appetizer with a double on the Guac!  Make time to visit Reds when in Toronto.Adaina Bar Manager Greg Bartender",4.0,2016-11-15,Yelp
"The steak dinner was awesome! We got a chipotle steak that was part of $32 prix fixe menu.The place was busy even during the week on a rainy day, so better make reservations.Ambiance and service were both great, wouldn't change a thing.",5.0,2016-11-06,Yelp
"The atmosphere is really nice for an affordable restaurant. The chicken tacos dish was smaller than you would think (it was cheap though), but it was decently filling with the loaded baked potato and was pretty tasty. Service was efficient and not intrusive either. This is actually a pretty great chain restaurant in terms of the food and atmosphere.",4.0,2016-09-11,Yelp
"Really great atmosphere, good service, mediocre food. I was here with some co-workers for lunch today, and the cool rustic decor (check out the chandelier made out of wine bottles and glasses!) and friendly hostess/servers gave me high hopes that the food would be just as great. Sadly, that was not the case. The five of us shared the steamed edamame and tavern butcher board. Both appetizers were good, but nothing too memorable. I ordered the Oscar Sirloin for my entree because it sounded amazing (steak topped with lobster, crab & shrimp, sauteed in tabasco butter, hollandaise sauce and chives), but it was pretty underwhelming. I had asked for it medium rare, and it was more on the medium well side, and a little too charred for my liking. The seafood that came with it wasn't very fresh and tasted inconsistent (some bites were really salty and fishy, others weren't). The side of mash potatoes were decent and tasted pretty good with the hollandaise. The tabasco butter gave everything a bit of a spicy kick. Definitely won't be rushing back for their food, but it seems like a fun place to catch up with friends over drinks and apps!",3.0,2015-11-05,Yelp
"Who is the chef, really? I had an excellent dish of Butter Chicken Bowl. It comes with naan bread and basmati rice. My fiancé loved his Chicken Tacos and baked potato side, as well. The atmosphere is casual and comfortable with nice decor. There is a large variety of food and drink options, ranging from salads, sandwiches, chicken, steak and fish. The prices seem reasonable. The wait staff are professional. It seems like a great place to meet up with friends for food or drinks; or watch some games on TV or hang out with your special someone. Awesome vibe, I'd eat here again.",4.0,2016-09-10,Yelp
"Simply Amazing! First the service; food and ambience is perfect. We took our aunt for her Bday and she loved it too. First time to Toronto and they def made our experience great! Cheers to Nicole for being a great waiter, Mike did great too he was training with her. Kudos!",5.0,2016-10-30,Yelp
We visited Toronto for a baseball game in the summer of 2016. A friend recommended Reds to us and we were so pleased. The food was fantastic- I had the roasted pork tenderloin. I never eat pork when I'm out because it is often too dry. This pork loin was prepared perfectly! Our server was wonderful. We plan on returning on our next trip to Toronto!,5.0,2017-01-13,Yelp
"Living in the area, I would consistently walk by this place on a daily basis, and would always admire their patio :p So, for my birthday, I decided to dine here. Ps- i give it a 4.5!Got a nice, cushioned patio seat, with a huge umbrella to protect from any rain/sun, and a barrier of flowers and plants to provide some privacy from people walking by on the street.  Decided to opt out of getting an app, solely because I wanted to enjoy my main, and I knew I'd be getting dessert on the house, which obviously I wanted to save room for  First we got our drinks, I ordered a maple bacon bourbon; a lot stronger than I anticipated!  Cost $12. For mains, I ordered the pork tenderloin with gnocchi, and my boyfriend chose a peppercorn steak with a side of mashed potatoes.  We also split a tiny side of fries. We waited a reasonable amount of time for our food to come, nothing below or above average. The quantity of food for me was perfect. Just enough so I could finish it all and not be left overly full! I should warn tou though, I do not have the worlds biggest appetite,  so if you think of yourself as being a big eater, consider ordering an app on top of your meal.In terms of taste, I really didn't have anything to complain about! The pork was cooked perfectly: nice and tender, not dried out AT ALL! The gnocchi were a little al dente, but I don't mind my pasta being on the harder side. The pasta could've used a liiitttllee more sauce, but no biggy.The flourless cake went above my expectations!  It came with cashews, a banana and chocolate mousse, and they even wrote ""happy birthday "" in chocolate sauce on the plate they served it to me on!  It was enough for us to share after the meals we just consumed!Through getting the dessert for free, ended up spending about $60 for both of us before tip. Not too shaby considering we went out with the intention of having a classier/pricier meal. If you're looking for a place to go out to celebrate a bit more of a special occasion,  I would recommend giving Red's a shot. The ambiance of the place is quite nice (makes you feel like a fancy person for dining there haha), and their menu offers quite a variety of choices,  so you can't really go wrong! :)",4.0,2015-09-04,Yelp
Delicious food - horrible service. Waitress looked like she was new or maybe just started but that's not an excuse for not listening to anything we tried to ask her or correct what she got wrong.,3.0,2017-01-08,Yelp
This place is large and has a classy feel. Great for a glass of wine or cocktail.Terrible if you are a vegetarian. No vegetarian main option. A few appetizers are vegetarian (maybe two or three). I do not recommend this place for dinner if there is a vegetarian in your group.,3.0,2016-01-24,Yelp
"Cute place for drinks and apps. We stopped in here for the lobster guacamole, mussels and some wine. They have a large bar and played really good music.Fun little place. Good pricing.",3.0,2015-10-14,Yelp
"Walked in when looking for a drink special on a VERY cold Wednesday night. The bartender was so friendly and took pity on a Florida girl experiencing -2 temperatures. I didn't get anything to eat, but loved the $5 (Canadian money) beer. The real treat here is the ""make your own gin and tonic"". OMG. I chose my gin, a nice light tonic and was able to put my own accoutrements in (juniper berries, orange peels, etc). TOTALLY worth the $11. The bathrooms were impeccably clean and very pretty (strange for a bar). The decor in general, was great. Loved the friendly atmosphere!",5.0,2015-02-24,Yelp
"We went twice during our short trip to Toronto and had a great meal both times - unique, creative dishes, but not too avant-garde, sort of innovative approaches to the classics.  Both my son and I were totally pleased with everything we got, from drinks to dessert.",5.0,2017-01-23,Yelp
"This place looks and seems like a pretty cool bar, but for meals... this place blows.We got seated and got menus, but after 15 minutes had to wave down a bartender walking by just to get waters. Then we had to get up and ask someone if we had a waiter to take our meal order..When the food finally got to us, it was boring and basic blah food.. and we were STARVING.I feel like this is the type of place that if I told someone from Toronto I ate there, they would say ""What? they serve food there?  I thought it was a bar/lounge""",2.0,2016-03-03,Yelp
I just love this place. When I'm in Toronto a visit is a must. Naturally the music is too loud to have a good conversation - but the place is just 'full of life'. I like the barkeeper brining out the ordered beer personally - and also the Somalier if you order wine. The food is really good - I like the shareables very much. Today I  just had mussels with some fries (as a side) - just delicious.,4.0,2015-08-15,Yelp
"Five stars for this place might be a bit excessive,  but here are my excuses....I came during Summerlicious at lunch with a large group (please let all those words sink in for a moment) and....1. Not only did the food not seem like a scant, bland version of some better menu, it was delicious and generous. The quinoa salad was superb, but better than that was the fried chicken, which unlike all fried chicken in Toronto, was not too salty, greasy, and overdone. Everyone at my table thoroughly enjoyed their lunch, which is damn hard to do with a big group.2. The service was excellent. Sure, a big restaurant that has large tables should know how to serve groups, maybe. Here, they actually do. The climactic moment of all group service- bringing and splitting the bill- went off without a hitch. The servers acted as if it were perfectly normal and easy to split a cheque. Imagine that!Hats off to Reds for a great lunch.",5.0,2015-07-27,Yelp
"Passed by this place many times.  Decided tonight was the night.  The place is very nicely set up - open concept very large TV screens and great decor.   Music was good also, not too loud just enough to not hear the people next to you.  Good beer selection (ok that's important to me!). I started with the Crab Chowder - it was delicious!  Followed that up with that butter chicken bowl- it was good - had some kick.  Overall nice place and good food and beer/drink selection in a nice setting",4.0,2016-01-18,Yelp
"I went to this restaurant for the Summerlicious 3 course $23 Lunch special with some friends. This was a recently built restaurant so everything looked new and gorgeous with a lot of industrial themed decorations which is a current trend. We made a reservation but it wasn't necessary as there was plenty of seats when we got there in the afternoon.Since there were three of us, we ordered and shared everything from the Summerlicious Menu:Appetizer: Quinoa, Summer Mixed Berry Salad, Shrimp Gazpacho SaladEntree: Roast California Striploin, Pan Seared Trout, Middle Eastern Fried ChickenDessert: Strawberry and Gin Parfait, Chili Chocolate Pot de Crème, Peach CrumbleFor the Appetizer, the berry salad was the winner. The whole salad had a berry scent with slight sweet taste and surprisingly, not too tart. The creamy goat cheese made the dish. It went well with the greens and sprinkle of berries.The Quinoa dish was light and fresh. The quinoa itself was neutral but the salty bitterness of the cheese and sweet apple balanced nicely. The salad also had some pickled onions, providing sour taste and the salad had some spiciness as well.The Shrimp gazpacho was light watery and refereshing for the summer season. The sour sweetness of the vinaigrette sauce in the cup provided a spash of flavour.For entree, the trout and sirloin were both good.The trout was crispy and well seasoned. The skin especially was deliciously crunchy and slightly saltier. It was served how on a bed of lentils. There was a slight sourness from the vinigarett on the beets and matched the creaminess of the avacado. The lentils were not that good however. it was quite chewy having its own separate flavour that didn't match the rest of the dish.The sirloin was juicy, soft, creamy and was light red in the center. It was served hot on a bed of potatoes with sauce. It was exactly what I expect when I think of a steak meal. It is like a hardy english meal. The squash squash matches the creaminess of the meat but lighter and made me think of gravy. This was better than the trout. Visually, the chicken dish was disappointing. It looked like there was more salad than meat. The chicken breast strips were spicy, slightly juicy but not too salty. You can tell that it is not a typical piece of fried chicken. oil spice was drizzled on to the chicken and the salad. The salad that came with this was too sour for my tastes, especially the beets. The chick pea croutons gave a nice crunch to the salad.    For the dessert, the parfait stood out the most. All the dessert had a similar mason jar presentation but not all of them were done well. About the parfait, you could taste the rose water in the whole dessert. The lady finger by itself was sweet but dipped in the parfait made it even sweeter yet, it was not too much for me. The taste reminded me of strawberry shortcake.The chocolate pot was not what I had expected. This pudding had chili flakes that were hard to notice although there, and the whole dish was pretty salty and full of bitter coffee taste. The peach crumble did not have much crumble at all and was pretty soggy. The ice cream was half melted when it arrived because it took so long to get to us. The service was good. The hostess let us choose a seat we preferred and the server gave us sharing plates when we noted that we wanted to try everything on the menu (that doesn't happen often). All the servings came at the same time. The server was available and came to chat about the dishes occasionally. The dessert however took a very long time to get to the table. When looking to get the bill, our server was busy with another customer also doing the same and took a while to get to us.",3.0,2016-03-05,Yelp
