Reviews,Ratings,Dates,Website
"So, last night I was invited out to a concert by my girlfriend at the last minute when a friend bailed. She had paid for the tickets so I thought I would take her out for an early dinner in the area before the show.Seeing as Reds Midtown is in the area and that I like the original I figured we could give their new ""midtown"" location a try. This was probably a mistake.I've been to the original Reds on a few occasions and have always found it to be a good afterwork location in the financial district. However, their new location has left me with a bad taste in my mouth. This bad taste is a lot like a big warm glass of pure butter (more on this in a bit).We arrive at dinner just before 7 and were greeted by a friendly hostess who gladly took us to our table. The restaurant was half full but we were ""lucky"" enough to be seated at a half lit table right by the entrance of the kitchen. This table is great for people who really want to see the inner workings of the restaurant world because after last night I now have a full understanding as to how waiters punch in orders and the bickering between staff that goes on at the entrance to a kitchen. (Incase you didn't realize I'm being sarcastic and I found this table to be a personal attack on me as a human being)After strategically picking seats so that we were both in lit portions of the table we decided to peruse the menu. The first thing that became clear was that this is a far smaller menu than the original Reds with more of a focus on the casual items from Reds. After an elongated wait I ordered The Stockton St Club, my girlfriend got The Southern Thai Slaw and to start we split the Yukatan Ceviche.(NOTE ABOUT THE MENU: There is no ""Stockton St"" in Toronto. Though after a lengthy investigation there appears to be a Stockton Rd at The Allen and 401. Sooooooo, typo perhaps?)Let's start at the beginning, shall we? The ceviche left a lot to be desired. Delivered in an old fashioned glass it was pretty much impossible to get to the ceviche with the supplied tortillas once we were halfway done. Beyond this glaring failure in dish engineering the ceviche just stunk. The fish lacked firmness to the point where it was essentially mush. The dish was mixed poorly with not nearly enough acid at the top and far too much at the bottom. As if that wasn't enough the kicker was the fact that they didn't even give us plates. But hey! When you're at a table like this what more do you want?!Onto the mains, the club sandwich had some sort of green paste mixture that I'm pretty sure in the freshest guacamole that Subway has to offer. This sandwich is also great if you've ever wanted to taste what a piece of rye bread dipped into a vat of butter tastes like. The sandwich was falling apart before I even took my first bite as the soggy butter bread just could not take it anymore! Needless to say I don't know what club I'm in after having this disaster but I want out.I don't know if there's anything I can say about The Sourthern Thai Slaw Salad that my girlfriend didn't say when I asked her how it was. She frowned and said, ""This sucks"".There you have it! Don't go to Reds Midtown because it is just the worst.Honestly, I'd dump me too if I took me to a place like this.",2.0,2014-05-14,Yelp
We take our clients here for drinks as they've just opened a patio here a few weeks ago. Good wine list by the glass and great wine list by the bottle. Interesting decor and a corporate vibe. One of my favorite healthy dishes is the cabbage chicken rolls. It comes with a peanut sauce and red chili pepper paste. Ive also had a quinoa salad and added chicken - again great dish and good portion sizes.,4.0,2014-07-29,Yelp
Good Spicy Caesars but a bit too much vodka and it's a bit more expensive than other bars (Frog and Firkin has awesome Spicy Caesars for less than $6. It was around $9 here). Patio is nice in the summer.,3.0,2014-07-11,Yelp
"1: Poor 2: OK 3: Good 4: Very Good 5: ExcellentFood: 3.5Service: 3.5Ambiance: 4Overall: 3.5Extra information:* Wine Bar* Takes reservations* Private Parties* Party room* Open for lunch and dinnerWhere do you go for dinner when you have to stick around Dundas square? We don't get that many options unless we are willing to walk couple blocks away from the busy intersection.All we are left with is franchise restaurants (not that there is anything wrong with them, my favorite is Joeys) like Joeys, Jack Astors, Milestones, Pickle Barrel and etc.So when I heard Reds Tavern was opening a second location at Gerrald and Yonge, I was more than happy to check it out- especially since I had pretty good dining experience at the one located on Adelaide in Financial District.This location is much more 'hip and young' compared to the other location, filled with younger crowd from Ryerson and Eaton's Centre.Reds Midtown Tavern is led by Executive Chef Matt Robertson, who has created an impressive menu of reimagined classics with a unique selection of social sharing plates.Ordered: Calamari Fritti Di Amalfi 5/5Oven roasted tomato aioli, fresh lime and fried rosemary and lemon for $11.25. I loved this calamari, first of all I was surprised by how big the portion was- it was enough to share between 4 people. It was done perfectly, seasoned just right and crispy outside. Very often I find aioli served at restaurants to be too watery, but the oven roasted tomato aioli that was served with calamari was bursting with flavor. I will def get this dish again when I go back.Ordered: Maine Lobster Guacamole 3/5Guajillo chili dressed lobster, hand mashed avocado, fresh lime juice, serrano pepper and warm, crisp tortillas for $17.95. This was an appetizer that I was very excited about but didn't really live up to my expectation. Crispy chips and guacamole was standard but the lobster on top didn't do much for me. Lobster pieces were big and fresh but it just didn't go together with the guacamole nor did it have much flavor.Ordered: Cheeseburger Sliders 4/5Classic mini burgers served with tangy American cheese, everything sauce and pickle for $14.50. 3 of these were served for us to share and they were surprisingly delicious. Patties were tender and juicy between Ace bakery mini slider buns and would be good even as a main dish.Ordered: North Atlantic Seafood Chowder 2.5/5Traditional New England chowder with cold water white fish, tender surf clams and a hint of smoked bacon, cup for $6 or bowl for $9. I ordered a cup to try and was satisfied with what it was. Creamy and filled with lots of seafood but it's not something I will remember to order again.Ordered: Wild Mushroom Soup 2/5Herb scented roasted chicken broth with woodland mushrooms, truffled enoki salad and crisp parmesan croutons, cup for $6 or bowl for $9. This is not your ordinary creamy mushroom soup! Some people might like this but I didn't really enjoy it.Ordered: Avocado & Lobster CobbEast Coast lobster with crisp pork belly, 63-degree egg, fresh croutons, cherry tomato and a poached shallot dressing for $26.95. This was another dish I was disappointed with. There weren't much lobster on this Lobster Cobb Salad and even minus the lobster, it wasn't a good Cobb salad. I def didn't think this was worth $26.95Ordered: Bake Kale & Quinoa Salad 3/5Tossed with sweet spiced pecans, dried cranberries, caramelized sweet potatoes, smoked Manchego cheese and a citrus vinaigrette for $9.50 (Starter size). This dish was ordered and shared as an appetizer and it was a nice light salad on the side.Ordered: Cioppino 5/5Light tomato and white wine seafood stew with PEI mussels, calamari, shrimp and scallops served with crusty garlic rubbed baguette for $19.25. Another solid dish I was excited to find during this dinner. Tomato stew was nice and hearty, def a winter food that makes you all warm inside. I will def get this again when I go back.Summary: Thank goodness Reds Midtown Tavern opened on Gerrald street where it is much more laid back without that stiff financial crowd. It is a nicer walk from where I live and love the wide wine selection. I've been back couple more times after my first visit and I've always had an awesome time here. Def check it out when you are in the area and make sure to try the Grasshopper Parfait for dessert if you have room, it is so awesome!",4.0,2014-01-13,Yelp
I'm at different restaurants daily with my job. Reds has a great atmosphere and amazing staff,5.0,2014-05-31,Yelp
"I can't believe this is at Yonge and Gerrard! What a change!This is quite an upscale pub for the area. The Elephant and Castle and Pogue Mahones have been the only choices nearby for years, but this pub really takes it up a notch.This is a huge restaurant with a wonderful atmosphere and a couple of partial second floors, meaning most of the space has huge ceilings. Lots of brick and interesting light features.The beer and cocktail list is extensive, as you would expect from a more upscale pub. The prices were actually pretty reasonable though, which I wasn't expecting.The menu was also interesting. I went with the tandoori-spiced chicken salad, and it was very flavourful with a decent portion size.The service was great and well organized. I arrived before my wife and they took her name so that they could direct her to my table. Again, this place is very big.I definitely plan to return to explore the rest of the menu. There will also be an outdoor patio at the corner near Yonge, which I think will be fantastic for the area.",4.0,2013-12-14,Yelp
"Got a really good first impression by the friendly hostess and ambience of the place but once i sat at the bar everything went downhill from there. Waited over 5 minutes to even get acknowledged by the bartender. No hi how are you or friendly small talk or even a crack of a smile. I ordered the chicken tandoori salad. I was told it was a good choice but it was quite opposite. The chicken was too charred so all i good taste was burnt charred chicken. I was also told the chicken was a 5-6oz portion...negative...it was only about 3oz. They were chinsy on the cashews (only got two in my salad) and crispy cauliflower (only a few little pieces). The bartender never once asked me how my food was. I would have asked for a new chicken and more topping had i been given the opportunity but didn't feel like complaining. After the subpar meal the server handed me the bill. I paid and still tipped her 20% and thanked her. There was no reciprocation whatsoever...she didnt seem in the slightest grateful for a 20% tip that she certainly didn't deserve as there was thank you...no you're welcome...no have a nice evening. Just left a bad taste in my mouth. I'm not sure how that bartender even has a job there. The quality of service and a friendly, outgoing personality is what matters most during a dining experience and i know this because i worked in the hospitality and service industry for over 15 years. Pretty straightforward concept. Perhaps she was having an off day but everyone knows that in that industry in particular you gotta leave the excess baggage at the door. I would not go back based on the price tag and the impersonal experience.",1.0,2015-11-23,Yelp
"I had a chance to eat here for lunch and was very impressed. I have been to Reds in First Canadian Place several times and the Midtown location is consistent with that quality. The look is hip, trendy and relaxing. More importantly, the food was so delicious that I had to consciously remind myself not to scarf it all down quickly as it was a business luncheon. 100% recommend and great to have something of quality in the immediate area.",4.0,2014-02-24,Yelp
"Can you feel that? The immensity of all those souls resting above you? 78 storeys of young urbanites, with all their hopes and dreams and turmoil...Well, rest easy! The beer selection down here on the ground floor of the Aura tower is top drawer!Minus one star as the service was a bit absent.Will update once I actually eat something here.",4.0,2013-12-03,Yelp
"I came here with my boyfriend for our anniversary. He lives in the same building and I always pass by the restaurant. We thought to give it a try. The decor is absolutely amazing. Why do I give it two stars?We had to wait a ridiculous time for our meal and drinks. When the food came, it was just alright. I had the Cioppino. The food was a little cold when it came and my bread was burnt. On the other had, their calamari was absolutely delicious. For dessert, we share the flourless chocolate cake. Again, it took forever to come out and I did not like it one bit. It was way too sweet. I left the restaurant with mixed feelings and am not sure I'd return due to the incredibly slow service. Also, the food was just alright. I guess it also doesn't help that I had gotten food poisoning that night...",2.0,2014-06-19,Yelp
"Love this place! I live nearby and was pretty excited that a wine bar had opened up since there's nothing really like it in the area. I dropped in on a Friday night with a gal pal for a bottle of wine. The wine list was pretty good, although for a wine bar I would have expected a lot more on the list. The decor is sophisticated with funky modern (dimly lit) chandeliers, hardwood and luxe leather chairs stools. There's a semi-private area upstairs which has more of a vintage feel that would be great to hire out for a party or work function. I love bathrooms that have moisturiser etc. so an extra point for that! I wish we were hungry so we could have tried out the menu.My flatmate was somewhere else in the bar that night and told me that they have a beer sommeliar and he got a few free tastes of beer. He's been raving about the place ever since, so I think this is likely to become our local neighbourhood hang out!",5.0,2013-11-24,Yelp
Came here for drinks. Price was really expensive but I guess u are paying for the trendy location. Service was not bad. No parking but that's like most places downtown. I wouldn't return.,3.0,2015-04-18,Yelp
"I come here usually once every two weeks, the food is great and always fresh, got to make some friends here and I know I'm paying what I'm getting, the fish is always fresh and high quality, make sure you order the sea food dishes when you at here!",5.0,2014-12-17,Yelp
"During our Toronto visit, we came across Reds Midtown Tavern and it was a gem of a find.  We enjoyed the baby kale quinoa salad, the potato flatbread, as well as the chowder and mushroom soups.  Each item was fresh, tasty and served in a timely manner.  The quality of service was just as superb as the food. Erin, our server made us out of towners feel right at home. Thanks Reds for a memorable dining experience!",5.0,2014-08-02,Yelp
"Great decor and wait staff were great.Thought the menu was hit or miss, and was disappointed by the lack of daily specials and just 3 dessert options.Calamari were great, the hummus/side dip was delicious.Flatbread was well received too.Mains:PEI Mussels: Good portion, nice presentation.Cioppino: Very disappointing.  It tasted like pasta sauce mixed with some canned tomatoes and hot sauce, not a broth at all. Lamb Shank: Not bad.Overall fair prices and decent wine list.  A bit more menu variety is definitely needed.  3+ , would return.",3.0,2014-01-14,Yelp
"Great food excellent service.  Had chicken carbonara dish with pasta and poached  egg in middle.  Music was good,  and place was Comfortable.  Thanks and props to my waitress   Jacqueline.  Oh and beers..  Yum",5.0,2013-11-12,Yelp
"Cam here with 16 other friends during Nuit Blanche because scaddabush next door was full. I like that it's easy to get a last minute seating for that many people. It seems to be a very loud sports bar. One of those places that you go and have a drink before going to clubs. Ordered the clam chowder as an appetizer. I was expecting it to be thick and creamy, but it seems to have more water than cream. So, that was disappointing. Then, I got the lamb for my main course. It was just a standard slow cooked lamb. Boring and unoriginal. Taste is ok, but it feels expensive paying $50 or so for dinner when served something that boring. I doubt that I will be coming back unless I'm eating with a big group.",3.0,2014-10-19,Yelp
"Went here last mothers day.  The decor is unique and beautiful.  The waitstaff were really fun.  The fire alarm in Aura above provided hilarious entertainment and the 'moms' were mondo-entertained by the firemen who arrived.  The food was good, and we had a great time!",4.0,2014-11-16,Yelp
"OK. I ordered the steak, it was over cooked, but still tasted good.  My potato had black spots in it, so the server brought me the truffle fries.... YUM.  Overall Ok.",2.0,2015-08-22,Yelp
Horrible service!!!!! Food is over priced and wasn't even good small portions and was served cold !   I had the server bring all of our food at once after we told her we wanted the salads to start. She also forgot about our drinks for about half an hour ! Overall terrible experience and I probably won't go back !,1.0,2014-06-09,Yelp
"Reds Midtown at yonge & gerrard has a great location, tasty cocktails and delicious shareable food.  It'll be a good place to head to after work for a drink, date night or even a get together.  It's a huge space with lots of room for groups it seemed.Favourite dish was the crispy potato flatbread, which was a savoury beavertail like dish... just amazing and couldn't get enough of it.  The steak frites was amazing as well! Didn't expect them to have such delicious steak but it was one of the best I've tasted in the city so far.Chowder was great and their baby kale salad was delicious too... I really don't have anything negative to say as I fell in love with the spot and have suggested it to many friends already!",5.0,2014-01-03,Yelp
"Love this place!  Great staff and great beer selection! Love the food 2!Defiantly a great addition to the neighbourhood and will def be a constant stop in the city, great bar staff and even greater management staff! Try the flat bread and the sliders.",5.0,2013-12-27,Yelp
"Awesome spot to grab a drink or cocktail, open until 1:00am during the week when a lot of other spots are closed. Nice big open space and they do have a couple of tv's at the bar. If you want a simple snack grab the nachos and guacamole. The washroom has a push to lock button. Make sure you remember to push it. LoL Cheers!",5.0,2014-05-12,Yelp
"Great atmosphere, friendly staff. Decor is out of this world. Went there for drinks, no food. Stayed for a few hours. Really enjoyable.",4.0,2014-11-23,Yelp
The private menu for handmade Gin cocktails is potent and amazing!! The Kale salad is alright but not overwhelming in flavours. The carbonara chicken was amazing! Staff took good care to look after our table and they were even able to dim the lights for us by request. Generally a wonderful time.,4.0,2014-11-15,Yelp
"Nice atmosphere and easy walking distance from the eaton Center. The appetizer and shareable menus are ideal for late snack or after work gathering. Entree offering are limited and you might find something you like. The bar is well stock with wine, liquor and craft beer.The hostess on shift tonight did not really ask us where to sit. She kept putting us in the back or in a corner that didn't work for us. At the end, we asked if we can sit where we wanted.",4.0,2014-11-15,Yelp
"I went here for summerlicios and ordered the sole crisp salad, the steak and parfait for dessert. The food was cold, under seasoned, the meat was tough, fatty and barely edible.  The food came out so fast you know the food wasn't made to order. It's too bad, summerlicious is supposed to allow you to try your menu and potentially gain new patronage. If I hadn't been here before then I would recommend not to go but maybe skip the prix fixe menu as it's underwhelming.",2.0,2015-07-11,Yelp
"Popped in for a beer and sonething to eat. I would advise change to the menu for the mushroom soup, advising it has chicken stock.",4.0,2014-10-26,Yelp
"I went here with a few friends with high expectations. The decor is just awesome and makes for a great atmosphere inside. Of the three mains we had at the table, none of them were exciting or anything I would recommend. I'd be more likely to come back here for drinks and appetizers than for a sit down meal.",3.0,2014-10-25,Yelp
"Nice looking place with plenty of craft beers, and the folks that work there were great. The food was a bit of a mess, the $20 charcuterie board was an embarrassment - that being said, the frites were proper. I'd go back for a beer, but not as a spot to eat. Basically this is a Jack Astor's for the 19 - 25 hipster crowd.",2.0,2013-12-16,Yelp
I was on Friday August 1st for our date night and we had a great time.  The service was great and very attentive.  The G&T's are good but a little pricey for my liking - although it didn't stop me from ordering two!  The food was delicious: we started with the crispy potato flat bread and ceviche; and the cioppino for my main.  All were very flavorful I would recommend.  My only compliant would be that there isn't a lot to choose from on the menu for dinner.  Definitely a good spot for drinks and apps!,4.0,2014-08-04,Yelp
"This restaurant is in such a beautiful space. I love the light fixtures! We had a reservation for 10, which was acknowledged upon arrival. Our server (who looked like Katy Perry) was informative of both the food and drink menu. Extensive beer selection and standard wine list. There are unique large gin based drinks, reasonably priced ($10-$13). I had the ceviche as a starter and oscar sirloin with fully loaded potato. The ceviche was alright and the portion was small--6-7 chips topped with ceviche for $13 was steep. I had hoped there was more toppings, as my potato was bare after 3 bites. The highlight of my meal was undoubtedly the steak; cooked perfectly rare and of quality. The other girls at my table also commented on how great their steaks were, and how we would come back for it. The sticky toffee dessert ($7) was small but really good. Do NOT order the flourless chocolate cake; the texture and taste resembles canned icing with a caramelized banana on top. All in all, a beautiful atmosphere with reasonably priced drinks, good food (depending on what you order), and nice service.",4.0,2015-02-22,Yelp
"I dine weekly at any of the restaurants by Sir Crop, the management company that owns Red's. I spend over $800 a month at their restaurants and have always received good to excellent service. So I was very much looking forward to a Friday night out with a bottle of wine at Red's. What an absolute disappointment.We ordered our favorite, a Kermit Lynch Cote-du Rhone that was selling at an extremely good price ($42) as we typically pay over $60 for this bottle in Yorkville. It was disappointing to learn, 10 minutes later, that this wine was out of stock. Our waiter then mentioned they were out of 3 additional bottles, and after he pointed out which ones, we proceeded to order a different bottle of wine from Italy as well as some food. Imagine our surprise when he came back another 10 minutes later to tell us, that this bottle too, was out of stock. After asking him to check his cellar and come back, something he refused to do and insisted that they had all the other wines, we finally ordered a 3rd bottle. Few minutes pass and he comes back with a bottle. We take a look at it, and realize he has brought the wrong wine from a totally different Region (we ordered a European wine and he bought us one from Argentina). We point this out to him, and please note, it has now been 30 minutes and we have no food or wine. He goes to the bar and then comes back saying that this 3rd bottle is also sold out so they just substituted it to a different bottle! Rightfully so, I got angry and asked to speak to their manager. Their manager, whom I will not name, came over to us with a smirk on his face. I assume he thought we were students looking for a hand out. He leaned over our table, put his chin on his hands, and asked us what he could do for us. I re-iterated the story and the entire time he was just smirking away and not really caring about what we said. Not once did he apologize, he just made excuses and told us to give him 7-10 minutes to see what he had in his cellar. Within a munute he comes back with our original Cote-Du-Rhone! At this point, we wer done and asked to leave. Rather then apologizing, he just said 'Are you sure you want to leave? I will comp this bottle which should make you happy'. That was just adding insult to the injury here and we walked out.I received a survey asking me to rate my experience and I gave it a 0. I e-mailed back and forth with their Regional manager who apologized and made excuses and finally offered me a free dinner with a bottle of wine as well as a personal apology on the day we go there. I finally agreed to this as I thought he was trying. So when I gave him a date, imagine how I felt when he said he will e-mail a $50 gift card to the restaurant of my choiceThey do not value customers. If they did, they would genuinely try to apologize, and if management is saying I will be there personally to greet you and dinner with wine is on me, why are you sending in a gift card and then capping dinner? The restaurant we chose - minimum we have ever spent there is $160!! We declined his offer, as again, we wanted to bring attention to the service issues and get a proper apology, not a freebie. I will be thinking twice before I ever go into any of Sir Corp restaurants again will make sure I tell everyone of my experience.tripadvisor.ca/ShowUserR…",1.0,2015-06-22,Yelp
